{
  "schema_version": "ISRAS-EXTERNAL-CROSSWALK-V1",
  "status": "DEVELOPMENT_CANDIDATE",
  "reviewed_on": "2026-07-16",
  "certification_claim": false,
  "baselines": [
    {
      "baseline_id": "NIST-SSDF-1.1",
      "name": "NIST Secure Software Development Framework",
      "version": "1.1 / SP 800-218",
      "pin_status": "PINNED",
      "source_identifier": "NIST SP 800-218 final"
    },
    {
      "baseline_id": "NIST-CSF-2.0",
      "name": "NIST Cybersecurity Framework",
      "version": "2.0",
      "pin_status": "PINNED",
      "source_identifier": "NIST CSF 2.0 final"
    },
    {
      "baseline_id": "NIST-800-53-R5-5.2.0",
      "name": "NIST SP 800-53 Revision 5",
      "version": "Release 5.2.0",
      "pin_status": "PINNED",
      "source_identifier": "NIST SP 800-53 Rev. 5 Release 5.2.0"
    },
    {
      "baseline_id": "SLSA-1.2",
      "name": "Supply-chain Levels for Software Artifacts",
      "version": "1.2",
      "pin_status": "PINNED",
      "source_identifier": "SLSA specification v1.2"
    },
    {
      "baseline_id": "OPENSSF-SCORECARD-CANDIDATE",
      "name": "OpenSSF Scorecard checks",
      "version": "UNPINNED-CANDIDATE",
      "pin_status": "REVIEW_REQUIRED",
      "source_identifier": "Exact release or source commit required before v3 phase entry"
    },
    {
      "baseline_id": "OWASP-SAMM-2",
      "name": "OWASP Software Assurance Maturity Model",
      "version": "2.x candidate baseline",
      "pin_status": "REVIEW_REQUIRED",
      "source_identifier": "Exact accepted SAMM revision required before v3 phase entry"
    },
    {
      "baseline_id": "OWASP-ASVS-5.0.0",
      "name": "OWASP Application Security Verification Standard",
      "version": "5.0.0",
      "pin_status": "PINNED",
      "source_identifier": "OWASP ASVS 5.0.0"
    },
    {
      "baseline_id": "CIS-SSC-GUIDE-1.0",
      "name": "CIS Software Supply Chain Security Guide",
      "version": "1.0",
      "pin_status": "PINNED",
      "source_identifier": "CIS Software Supply Chain Security Guide v1.0"
    },
    {
      "baseline_id": "FBI-CJIS-6.1",
      "name": "FBI CJIS Security Policy",
      "version": "6.1",
      "pin_status": "PINNED",
      "source_identifier": "FBI CJIS Security Policy v6.1"
    }
  ],
  "mappings": [
    {
      "control_id": "ISRAS-GOV-001",
      "state": "PARTIALLY_COVERED",
      "external_references": [
        {
          "baseline_id": "NIST-SSDF-1.1",
          "reference": "PO"
        },
        {
          "baseline_id": "NIST-CSF-2.0",
          "reference": "GV"
        },
        {
          "baseline_id": "NIST-800-53-R5-5.2.0",
          "reference": "PM/PL/SA/SR"
        },
        {
          "baseline_id": "OWASP-SAMM-2",
          "reference": "Governance"
        }
      ],
      "remaining_responsibility": "The mapping is relational and does not replace assessment against the external source."
    },
    {
      "control_id": "ISRAS-GOV-002",
      "state": "PARTIALLY_COVERED",
      "external_references": [
        {
          "baseline_id": "NIST-SSDF-1.1",
          "reference": "PO"
        },
        {
          "baseline_id": "NIST-CSF-2.0",
          "reference": "GV"
        },
        {
          "baseline_id": "NIST-800-53-R5-5.2.0",
          "reference": "PM/PL/SA/SR"
        },
        {
          "baseline_id": "OWASP-SAMM-2",
          "reference": "Governance"
        }
      ],
      "remaining_responsibility": "The mapping is relational and does not replace assessment against the external source."
    },
    {
      "control_id": "ISRAS-GOV-003",
      "state": "PARTIALLY_COVERED",
      "external_references": [
        {
          "baseline_id": "NIST-SSDF-1.1",
          "reference": "PO"
        },
        {
          "baseline_id": "NIST-CSF-2.0",
          "reference": "GV"
        },
        {
          "baseline_id": "NIST-800-53-R5-5.2.0",
          "reference": "PM/PL/SA/SR"
        },
        {
          "baseline_id": "OWASP-SAMM-2",
          "reference": "Governance"
        }
      ],
      "remaining_responsibility": "The mapping is relational and does not replace assessment against the external source."
    },
    {
      "control_id": "ISRAS-REP-001",
      "state": "PARTIALLY_COVERED",
      "external_references": [
        {
          "baseline_id": "NIST-SSDF-1.1",
          "reference": "PO.3/PS.1"
        },
        {
          "baseline_id": "SLSA-1.2",
          "reference": "source/build integrity"
        },
        {
          "baseline_id": "OPENSSF-SCORECARD-CANDIDATE",
          "reference": "Code-Review/CI-Tests"
        },
        {
          "baseline_id": "NIST-800-53-R5-5.2.0",
          "reference": "CM-2/CM-3/SA-10"
        }
      ],
      "remaining_responsibility": "The mapping is relational and does not replace assessment against the external source."
    },
    {
      "control_id": "ISRAS-REP-002",
      "state": "PARTIALLY_COVERED",
      "external_references": [
        {
          "baseline_id": "NIST-SSDF-1.1",
          "reference": "PO.3/PS.1"
        },
        {
          "baseline_id": "SLSA-1.2",
          "reference": "source/build integrity"
        },
        {
          "baseline_id": "OPENSSF-SCORECARD-CANDIDATE",
          "reference": "Code-Review/CI-Tests"
        },
        {
          "baseline_id": "NIST-800-53-R5-5.2.0",
          "reference": "CM-2/CM-3/SA-10"
        }
      ],
      "remaining_responsibility": "The mapping is relational and does not replace assessment against the external source."
    },
    {
      "control_id": "ISRAS-REP-003",
      "state": "PARTIALLY_COVERED",
      "external_references": [
        {
          "baseline_id": "NIST-SSDF-1.1",
          "reference": "PO.3/PS.1"
        },
        {
          "baseline_id": "SLSA-1.2",
          "reference": "source/build integrity"
        },
        {
          "baseline_id": "OPENSSF-SCORECARD-CANDIDATE",
          "reference": "Code-Review/CI-Tests"
        },
        {
          "baseline_id": "NIST-800-53-R5-5.2.0",
          "reference": "CM-2/CM-3/SA-10"
        }
      ],
      "remaining_responsibility": "The mapping is relational and does not replace assessment against the external source."
    },
    {
      "control_id": "ISRAS-REP-004",
      "state": "PARTIALLY_COVERED",
      "external_references": [
        {
          "baseline_id": "NIST-SSDF-1.1",
          "reference": "PO.3/PS.1"
        },
        {
          "baseline_id": "SLSA-1.2",
          "reference": "source/build integrity"
        },
        {
          "baseline_id": "OPENSSF-SCORECARD-CANDIDATE",
          "reference": "Code-Review/CI-Tests"
        },
        {
          "baseline_id": "NIST-800-53-R5-5.2.0",
          "reference": "CM-2/CM-3/SA-10"
        }
      ],
      "remaining_responsibility": "The mapping is relational and does not replace assessment against the external source."
    },
    {
      "control_id": "ISRAS-ENV-001",
      "state": "PARTIALLY_COVERED",
      "external_references": [
        {
          "baseline_id": "NIST-SSDF-1.1",
          "reference": "PO.3/PS.2/PW.6"
        },
        {
          "baseline_id": "SLSA-1.2",
          "reference": "build environment"
        },
        {
          "baseline_id": "NIST-800-53-R5-5.2.0",
          "reference": "CM-2/CM-8/SA-15/SR-3"
        }
      ],
      "remaining_responsibility": "The mapping is relational and does not replace assessment against the external source."
    },
    {
      "control_id": "ISRAS-ENV-002",
      "state": "PARTIALLY_COVERED",
      "external_references": [
        {
          "baseline_id": "NIST-SSDF-1.1",
          "reference": "PO.3/PS.2/PW.6"
        },
        {
          "baseline_id": "SLSA-1.2",
          "reference": "build environment"
        },
        {
          "baseline_id": "NIST-800-53-R5-5.2.0",
          "reference": "CM-2/CM-8/SA-15/SR-3"
        }
      ],
      "remaining_responsibility": "The mapping is relational and does not replace assessment against the external source."
    },
    {
      "control_id": "ISRAS-TST-001",
      "state": "PARTIALLY_COVERED",
      "external_references": [
        {
          "baseline_id": "NIST-SSDF-1.1",
          "reference": "PW.7-PW.9"
        },
        {
          "baseline_id": "NIST-800-53-R5-5.2.0",
          "reference": "SA-11/CA-2/CA-7"
        },
        {
          "baseline_id": "OWASP-SAMM-2",
          "reference": "Verification"
        },
        {
          "baseline_id": "OWASP-ASVS-5.0.0",
          "reference": "applicable verification requirements"
        },
        {
          "baseline_id": "OPENSSF-SCORECARD-CANDIDATE",
          "reference": "CI-Tests/SAST/Fuzzing"
        }
      ],
      "remaining_responsibility": "Project-specific coverage, penetration testing, and domain verification remain required."
    },
    {
      "control_id": "ISRAS-TST-002",
      "state": "PARTIALLY_COVERED",
      "external_references": [
        {
          "baseline_id": "NIST-SSDF-1.1",
          "reference": "PW.7-PW.9"
        },
        {
          "baseline_id": "NIST-800-53-R5-5.2.0",
          "reference": "SA-11/CA-2/CA-7"
        },
        {
          "baseline_id": "OWASP-SAMM-2",
          "reference": "Verification"
        },
        {
          "baseline_id": "OWASP-ASVS-5.0.0",
          "reference": "applicable verification requirements"
        },
        {
          "baseline_id": "OPENSSF-SCORECARD-CANDIDATE",
          "reference": "CI-Tests/SAST/Fuzzing"
        }
      ],
      "remaining_responsibility": "Project-specific coverage, penetration testing, and domain verification remain required."
    },
    {
      "control_id": "ISRAS-DOC-001",
      "state": "PARTIALLY_COVERED",
      "external_references": [
        {
          "baseline_id": "NIST-SSDF-1.1",
          "reference": "PO.1/PO.2/PW.1"
        },
        {
          "baseline_id": "NIST-CSF-2.0",
          "reference": "GV.PO/ID.IM"
        },